[
  {
    "_id": "order_1",
    "userId": "user_1",
    "amount": 49.99,
    "status": "paid",
    "date": "2024-01-05T10:00:00Z"
  },
  {
    "_id": "order_2",
    "userId": "user_1",
    "amount": 129,
    "status": "paid",
    "date": "2024-01-20T14:30:00Z"
  },
  {
    "_id": "order_3",
    "userId": "user_2",
    "amount": 35.5,
    "status": "pending",
    "date": "2024-02-01T09:15:00Z"
  },
  {
    "_id": "order_4",
    "userId": "user_3",
    "amount": 210,
    "status": "paid",
    "date": "2024-02-10T11:00:00Z"
  },
  {
    "_id": "order_5",
    "userId": "user_4",
    "amount": 89.99,
    "status": "cancelled",
    "date": "2024-02-15T16:45:00Z"
  },
  {
    "_id": "order_6",
    "userId": "user_4",
    "amount": 450,
    "status": "paid",
    "date": "2024-02-20T08:00:00Z"
  },
  {
    "_id": "order_7",
    "userId": "user_5",
    "amount": 15,
    "status": "paid",
    "date": "2024-03-01T12:30:00Z"
  },
  {
    "_id": "order_8",
    "userId": "user_6",
    "amount": 320,
    "status": "paid",
    "date": "2024-03-05T10:00:00Z"
  },
  {
    "_id": "order_9",
    "userId": "user_6",
    "amount": 75.5,
    "status": "pending",
    "date": "2024-03-10T15:00:00Z"
  },
  {
    "_id": "order_10",
    "userId": "user_7",
    "amount": 99,
    "status": "paid",
    "date": "2024-03-12T09:00:00Z"
  },
  {
    "_id": "order_11",
    "userId": "user_8",
    "amount": 180,
    "status": "cancelled",
    "date": "2024-03-15T11:30:00Z"
  },
  {
    "_id": "order_12",
    "userId": "user_9",
    "amount": 55,
    "status": "paid",
    "date": "2024-03-18T13:00:00Z"
  },
  {
    "_id": "order_13",
    "userId": "user_9",
    "amount": 90,
    "status": "paid",
    "date": "2024-04-01T10:00:00Z"
  },
  {
    "_id": "order_14",
    "userId": "user_10",
    "amount": 260,
    "status": "paid",
    "date": "2024-04-05T09:30:00Z"
  },
  {
    "_id": "order_15",
    "userId": "user_11",
    "amount": 145,
    "status": "pending",
    "date": "2024-04-10T14:00:00Z"
  },
  {
    "_id": "order_16",
    "userId": "user_12",
    "amount": 38,
    "status": "paid",
    "date": "2024-04-12T16:00:00Z"
  },
  {
    "_id": "order_17",
    "userId": "user_13",
    "amount": 500,
    "status": "cancelled",
    "date": "2024-04-15T11:00:00Z"
  },
  {
    "_id": "order_18",
    "userId": "user_14",
    "amount": 300,
    "status": "paid",
    "date": "2024-04-20T08:30:00Z"
  },
  {
    "_id": "order_19",
    "userId": "user_14",
    "amount": 120,
    "status": "paid",
    "date": "2024-05-01T10:00:00Z"
  },
  {
    "_id": "order_20",
    "userId": "user_15",
    "amount": 65,
    "status": "pending",
    "date": "2024-05-05T13:30:00Z"
  },
  {
    "_id": "order_21",
    "userId": "user_16",
    "amount": 200,
    "status": "paid",
    "date": "2024-05-10T09:00:00Z"
  },
  {
    "_id": "order_22",
    "userId": "user_17",
    "amount": 85,
    "status": "paid",
    "date": "2024-05-15T11:00:00Z"
  },
  {
    "_id": "order_23",
    "userId": "user_18",
    "amount": 410,
    "status": "paid",
    "date": "2024-05-18T14:00:00Z"
  },
  {
    "_id": "order_24",
    "userId": "user_18",
    "amount": 55.5,
    "status": "cancelled",
    "date": "2024-05-22T10:30:00Z"
  },
  {
    "_id": "order_25",
    "userId": "user_19",
    "amount": 22,
    "status": "paid",
    "date": "2024-06-01T09:00:00Z"
  },
  {
    "_id": "order_26",
    "userId": "user_20",
    "amount": 175,
    "status": "paid",
    "date": "2024-06-05T12:00:00Z"
  },
  {
    "_id": "order_27",
    "userId": "user_21",
    "amount": 340,
    "status": "pending",
    "date": "2024-06-10T08:00:00Z"
  },
  {
    "_id": "order_28",
    "userId": "user_22",
    "amount": 28,
    "status": "paid",
    "date": "2024-06-12T15:30:00Z"
  },
  {
    "_id": "order_29",
    "userId": "user_23",
    "amount": 750,
    "status": "paid",
    "date": "2024-06-15T10:00:00Z"
  },
  {
    "_id": "order_30",
    "userId": "user_23",
    "amount": 110,
    "status": "paid",
    "date": "2024-06-20T11:00:00Z"
  },
  {
    "_id": "order_31",
    "userId": "user_24",
    "amount": 60,
    "status": "paid",
    "date": "2024-07-01T09:30:00Z"
  },
  {
    "_id": "order_32",
    "userId": "user_25",
    "amount": 195,
    "status": "cancelled",
    "date": "2024-07-05T14:00:00Z"
  },
  {
    "_id": "order_33",
    "userId": "user_26",
    "amount": 45,
    "status": "pending",
    "date": "2024-07-10T10:00:00Z"
  },
  {
    "_id": "order_34",
    "userId": "user_27",
    "amount": 155,
    "status": "paid",
    "date": "2024-07-12T13:00:00Z"
  },
  {
    "_id": "order_35",
    "userId": "user_28",
    "amount": 380,
    "status": "paid",
    "date": "2024-07-15T09:00:00Z"
  },
  {
    "_id": "order_36",
    "userId": "user_29",
    "amount": 70,
    "status": "paid",
    "date": "2024-07-18T11:30:00Z"
  },
  {
    "_id": "order_37",
    "userId": "user_30",
    "amount": 530,
    "status": "paid",
    "date": "2024-07-20T08:00:00Z"
  },
  {
    "_id": "order_38",
    "userId": "user_1",
    "amount": 200,
    "status": "pending",
    "date": "2024-08-01T10:00:00Z"
  },
  {
    "_id": "order_39",
    "userId": "user_4",
    "amount": 99.5,
    "status": "paid",
    "date": "2024-08-05T12:00:00Z"
  },
  {
    "_id": "order_40",
    "userId": "user_6",
    "amount": 140,
    "status": "paid",
    "date": "2024-08-10T14:30:00Z"
  },
  {
    "_id": "order_41",
    "userId": "user_10",
    "amount": 88,
    "status": "cancelled",
    "date": "2024-08-15T09:00:00Z"
  },
  {
    "_id": "order_42",
    "userId": "user_14",
    "amount": 215,
    "status": "paid",
    "date": "2024-08-20T11:00:00Z"
  },
  {
    "_id": "order_43",
    "userId": "user_18",
    "amount": 470,
    "status": "paid",
    "date": "2024-09-01T10:00:00Z"
  },
  {
    "_id": "order_44",
    "userId": "user_23",
    "amount": 180,
    "status": "pending",
    "date": "2024-09-05T13:00:00Z"
  },
  {
    "_id": "order_45",
    "userId": "user_28",
    "amount": 95,
    "status": "paid",
    "date": "2024-09-10T08:30:00Z"
  },
  {
    "_id": "order_46",
    "userId": "user_30",
    "amount": 260,
    "status": "paid",
    "date": "2024-09-15T10:00:00Z"
  },
  {
    "_id": "order_47",
    "userId": "user_2",
    "amount": 110,
    "status": "paid",
    "date": "2024-09-18T15:00:00Z"
  },
  {
    "_id": "order_48",
    "userId": "user_11",
    "amount": 320,
    "status": "paid",
    "date": "2024-09-22T09:00:00Z"
  },
  {
    "_id": "order_49",
    "userId": "user_15",
    "amount": 75,
    "status": "paid",
    "date": "2024-10-01T11:00:00Z"
  },
  {
    "_id": "order_50",
    "userId": "user_27",
    "amount": 430,
    "status": "paid",
    "date": "2024-10-05T14:00:00Z"
  }
]